{
  "$schema": "https://json-schema.org/draft/2020-12/schema",
  "$id": "urn:tsuuanmi:system:schema:board-task:v1",
  "title": "Board task",
  "description": "Durable state of one task on a project's board (ctx.board, design/board.md): work that outlives a run. Only the work state machine moves it, and each move names the decision behind it (INV-13). Mutable state that points at immutable artifacts. @1.1 adds a spent budget's funding: the lines a budget-spent wait asks for (`waiting.funding`), and the raises an approved request applied (`funding`). 1.2 adds the `defect` link: the done task this one fixes a defect of, and the landing sha of its change.",
  "type": "object",
  "required": ["schema", "taskId", "projectId", "title", "goal", "acceptance", "dependsOn", "actionClass", "state", "attempts", "createdAt", "revision"],
  "properties": {
    "schema": { "enum": ["board-task@1.0", "board-task@1.1", "board-task@1.2"] },
    "taskId": { "$ref": "urn:tsuuanmi:system:schema:common:v1#/$defs/id" },
    "projectId": { "$ref": "urn:tsuuanmi:system:schema:common:v1#/$defs/id" },
    "milestone": { "$ref": "urn:tsuuanmi:system:schema:common:v1#/$defs/id" },
    "title": { "type": "string", "minLength": 1, "maxLength": 200 },
    "goal": { "type": "string", "minLength": 1, "maxLength": 4000 },
    "acceptance": {
      "description": "Acceptance criteria, each checked before the task is done.",
      "type": "array",
      "minItems": 1,
      "maxItems": 32,
      "items": {
        "type": "object",
        "required": ["id", "statement"],
        "properties": {
          "id": { "$ref": "urn:tsuuanmi:system:schema:common:v1#/$defs/id" },
          "statement": { "$ref": "urn:tsuuanmi:system:schema:common:v1#/$defs/shortText" },
          "check": { "enum": ["tests", "typecheck", "lint", "schema", "quote-check", "review", "operator"] }
        },
        "additionalProperties": false
      }
    },
    "dependsOn": {
      "description": "Tasks of the same project that must be done first.",
      "type": "array",
      "maxItems": 64,
      "uniqueItems": true,
      "items": { "$ref": "urn:tsuuanmi:system:schema:common:v1#/$defs/id" }
    },
    "actionClass": {
      "description": "What running the task does, as the autonomy policy classifies it; it decides whether starting it needs a person.",
      "$ref": "urn:tsuuanmi:system:schema:common:v1#/$defs/actionClass"
    },
    "template": { "$ref": "urn:tsuuanmi:system:schema:common:v1#/$defs/id" },
    "writes": {
      "description": "The subject the task writes; one task holds write authority over it at a time (INV-15).",
      "$ref": "urn:tsuuanmi:system:schema:common:v1#/$defs/subject"
    },
    "budget": {
      "description": "The most the task's attempts may draw from each pool, together, as the resource ledger counts them for the task; a line reached blocks the task (budget-spent, INV-9). An approved funding request raises it (`funding`).",
      "type": "array",
      "maxItems": 16,
      "items": { "$ref": "urn:tsuuanmi:system:schema:common:v1#/$defs/budgetLine" }
    },
    "state": {
      "description": "Active: ready, claimed, running, review. Interrupted: waiting-for-input, waiting-for-approval. Terminal: done, cancelled. proposed waits for its dependencies and the policy.",
      "enum": ["proposed", "ready", "claimed", "running", "review", "waiting-for-input", "waiting-for-approval", "done", "cancelled"]
    },
    "attempts": {
      "type": "object",
      "required": ["count", "max"],
      "properties": {
        "count": { "type": "integer", "minimum": 0, "maximum": 10 },
        "max": { "type": "integer", "minimum": 1, "maximum": 10 }
      },
      "additionalProperties": false
    },
    "holder": {
      "description": "The lease on the task (resource board-task:<taskId>); a write presents its generation as a fence (INV-4, INV-15).",
      "type": "object",
      "required": ["owner", "generation", "leaseExpiresAt"],
      "properties": {
        "owner": { "$ref": "urn:tsuuanmi:system:schema:common:v1#/$defs/id" },
        "generation": { "type": "integer", "minimum": 1, "maximum": 1000000000 },
        "leaseExpiresAt": { "$ref": "urn:tsuuanmi:system:schema:common:v1#/$defs/timestamp" }
      },
      "additionalProperties": false
    },
    "run": {
      "description": "The run of the current attempt. Recorded before the run starts, so a restart reconciles it and never starts it again (INV-4).",
      "type": "object",
      "required": ["runId", "startedAt"],
      "properties": {
        "runId": { "$ref": "urn:tsuuanmi:system:schema:common:v1#/$defs/id" },
        "brief": { "$ref": "urn:tsuuanmi:system:schema:common:v1#/$defs/artifactRef" },
        "startedAt": { "$ref": "urn:tsuuanmi:system:schema:common:v1#/$defs/timestamp" }
      },
      "additionalProperties": false
    },
    "result": {
      "description": "What the attempt produced, recorded when it enters review, with the exact subject it leaves (a commit, or the result artifact for work with no repository).",
      "type": "object",
      "required": ["artifacts", "subject"],
      "properties": {
        "artifacts": {
          "type": "array",
          "minItems": 1,
          "maxItems": 32,
          "uniqueItems": true,
          "items": { "$ref": "urn:tsuuanmi:system:schema:common:v1#/$defs/artifactRef" }
        },
        "digest": { "$ref": "urn:tsuuanmi:system:schema:common:v1#/$defs/artifactRef" },
        "subject": {
          "description": "The exact subject after the attempt, e.g. the worktree's commit.",
          "$ref": "urn:tsuuanmi:system:schema:common:v1#/$defs/subject"
        },
        "files": {
          "description": "Paths touched, relative to the workspace.",
          "type": "array",
          "maxItems": 512,
          "uniqueItems": true,
          "items": { "type": "string", "minLength": 1, "maxLength": 1024 }
        },
        "acceptance": {
          "description": "The `acceptance` decision on the result; required to be done.",
          "$ref": "urn:tsuuanmi:system:schema:common:v1#/$defs/artifactRef"
        },
        "next": {
          "description": "A proposed next task, in words.",
          "type": "string",
          "maxLength": 2000
        }
      },
      "additionalProperties": false
    },
    "waiting": {
      "description": "Why an interrupted task waits, or a review the board holds for the operator, and until when. On expiry it never runs: an approval wait is rejected (fail closed), an input wait cancels the task, a review held for the operator ends review-expired.",
      "type": "object",
      "required": ["reason", "since", "expiresAt"],
      "properties": {
        "reason": {
          "description": "approval-needed: the policy asks before starting; budget-spent: an attempt spent its budget; reconciliation-failed: a started run could not be reconciled, so running it again needs approval; retries-spent: review rejected the last attempt allowed; question: the lead or operator must answer; rejected: an approval was refused or expired, or none could be asked (a spent budget or a lost run under a policy verdict other than ask); review-expired: no acceptance decision came before the reviewer's lease lapsed, or before a review held for the operator expired; operator-review: in review, only the operator's acceptance accepts the result now (a required check not passed, or the class forbidden), so the board holds the review for the operator, bounded by the policy's wait for the class.",
          "enum": ["approval-needed", "budget-spent", "reconciliation-failed", "retries-spent", "question", "rejected", "review-expired", "operator-review"]
        },
        "approvalRequest": { "$ref": "urn:tsuuanmi:system:schema:common:v1#/$defs/id" },
        "questions": {
          "type": "array",
          "maxItems": 8,
          "items": { "$ref": "urn:tsuuanmi:system:schema:common:v1#/$defs/shortText" }
        },
        "pendingChecks": {
          "description": "For operator-review: the class's required checks the acceptance did not report passed.",
          "type": "array",
          "maxItems": 6,
          "uniqueItems": true,
          "items": { "enum": ["tests", "typecheck", "lint", "schema", "quote-check", "review"] }
        },
        "funding": {
          "description": "@1.1, for budget-spent: the lines the funding request asks to add to the budget, at most one per pool and unit of it. The request's subject version is `budget-spent:<sha256 of their canonical JSON>`, so its verdict binds to exactly these.",
          "type": "array",
          "minItems": 1,
          "maxItems": 16,
          "items": { "$ref": "urn:tsuuanmi:system:schema:common:v1#/$defs/budgetLine" }
        },
        "since": { "$ref": "urn:tsuuanmi:system:schema:common:v1#/$defs/timestamp" },
        "expiresAt": { "$ref": "urn:tsuuanmi:system:schema:common:v1#/$defs/timestamp" }
      },
      "additionalProperties": false
    },
    "funding": {
      "description": "@1.1: each raise of `budget` an approved funding request applied, oldest first: the lines added, the operator's `approval` artifact, and the board's decision that applied them. One per attempt at most, so bounded by `attempts.max`.",
      "type": "array",
      "maxItems": 10,
      "items": {
        "type": "object",
        "required": ["lines", "approval", "decision", "at"],
        "properties": {
          "lines": {
            "type": "array",
            "minItems": 1,
            "maxItems": 16,
            "items": { "$ref": "urn:tsuuanmi:system:schema:common:v1#/$defs/budgetLine" }
          },
          "approval": { "$ref": "urn:tsuuanmi:system:schema:common:v1#/$defs/artifactRef" },
          "decision": { "$ref": "urn:tsuuanmi:system:schema:common:v1#/$defs/artifactRef" },
          "at": { "$ref": "urn:tsuuanmi:system:schema:common:v1#/$defs/timestamp" }
        },
        "additionalProperties": false
      }
    },
    "defect": {
      "description": "1.2: the defect this task fixes: `fixes` is the done task whose landed change held it, `sha` the landing sha of that change (7 to 64 hex characters), `at` when the link was set, `by` who set it (`filed`: when the task was filed). `system metrics` counts the tasks fixed as escaped defects.",
      "type": "object",
      "required": ["fixes", "sha", "at", "by"],
      "properties": {
        "fixes": { "$ref": "urn:tsuuanmi:system:schema:common:v1#/$defs/id" },
        "sha": { "type": "string", "pattern": "^[0-9a-f]{7,64}$" },
        "at": { "$ref": "urn:tsuuanmi:system:schema:common:v1#/$defs/timestamp" },
        "by": { "enum": ["filed", "lead", "reviewer", "operator"] }
      },
      "additionalProperties": false
    },
    "cancellation": {
      "type": "object",
      "required": ["reason", "at"],
      "properties": {
        "reason": {
          "description": "forbidden: the policy forbids its action; dependency-cancelled: a task it depends on was cancelled.",
          "enum": ["operator", "lead", "project-closed", "input-expired", "superseded", "forbidden", "dependency-cancelled"]
        },
        "note": { "$ref": "urn:tsuuanmi:system:schema:common:v1#/$defs/shortText" },
        "at": { "$ref": "urn:tsuuanmi:system:schema:common:v1#/$defs/timestamp" }
      },
      "additionalProperties": false
    },
    "createdAt": { "$ref": "urn:tsuuanmi:system:schema:common:v1#/$defs/timestamp" },
    "updatedAt": { "$ref": "urn:tsuuanmi:system:schema:common:v1#/$defs/timestamp" },
    "lastDecision": {
      "description": "Decision artifact that caused the latest state transition (INV-13).",
      "$ref": "urn:tsuuanmi:system:schema:common:v1#/$defs/artifactRef"
    },
    "revision": { "type": "integer", "minimum": 0, "maximum": 1000000000 }
  },
  "allOf": [
    {
      "if": { "properties": { "state": { "not": { "const": "proposed" } } } },
      "then": { "required": ["lastDecision"], "properties": { "lastDecision": true } }
    },
    {
      "description": "Only a claimed, running, or reviewed task holds a lease; a review the board holds for the operator holds none.",
      "if": { "properties": { "state": { "enum": ["claimed", "running"] } } },
      "then": { "required": ["holder"], "properties": { "holder": true } },
      "else": {
        "if": { "properties": { "state": { "const": "review" } } },
        "then": {
          "oneOf": [
            { "required": ["holder"], "properties": { "holder": true, "waiting": false } },
            { "required": ["waiting"], "properties": { "holder": false, "waiting": { "type": "object", "properties": { "reason": { "const": "operator-review" } } } } }
          ]
        },
        "else": { "properties": { "holder": false } }
      }
    },
    {
      "if": { "properties": { "state": { "enum": ["running", "review"] } } },
      "then": { "required": ["run"], "properties": { "run": true } }
    },
    {
      "if": { "properties": { "state": { "const": "review" } } },
      "then": { "required": ["result"], "properties": { "result": true } }
    },
    {
      "description": "Done needs the run that produced it, the result with its subject, and an accepted acceptance decision.",
      "if": { "properties": { "state": { "const": "done" } } },
      "then": {
        "required": ["run", "result"],
        "properties": { "run": true, "result": { "type": "object", "required": ["acceptance"], "properties": { "acceptance": true } } }
      }
    },
    {
      "if": { "properties": { "state": { "enum": ["waiting-for-input", "waiting-for-approval"] } } },
      "then": { "required": ["waiting"], "properties": { "waiting": true } },
      "else": {
        "if": { "properties": { "state": { "const": "review" } } },
        "then": true,
        "else": { "not": { "required": ["waiting"] } }
      }
    },
    {
      "if": { "properties": { "state": { "const": "waiting-for-approval" } } },
      "then": {
        "properties": {
          "waiting": {
            "type": "object",
            "required": ["approvalRequest"],
            "properties": { "approvalRequest": true, "reason": { "enum": ["approval-needed", "budget-spent", "reconciliation-failed"] } }
          }
        }
      }
    },
    {
      "if": { "properties": { "state": { "const": "waiting-for-input" } } },
      "then": { "properties": { "waiting": { "type": "object", "properties": { "reason": { "enum": ["retries-spent", "question", "rejected", "review-expired"] } } } } }
    },
    {
      "if": { "properties": { "state": { "const": "cancelled" } } },
      "then": { "required": ["cancellation"], "properties": { "cancellation": true } },
      "else": { "not": { "required": ["cancellation"] } }
    },
    {
      "description": "@1.1: a funding ask is a budget-spent wait's, and a record that carries an ask or a raise is @1.1, so a reader on @1.0 never meets one.",
      "if": {
        "anyOf": [
          { "required": ["funding"], "properties": { "funding": true } },
          { "required": ["waiting"], "properties": { "waiting": { "type": "object", "required": ["funding"], "properties": { "funding": true } } } }
        ]
      },
      "then": { "properties": { "schema": { "enum": ["board-task@1.1", "board-task@1.2"] } } }
    },
    {
      "if": { "required": ["waiting"], "properties": { "waiting": { "type": "object", "required": ["funding"], "properties": { "funding": true } } } },
      "then": { "properties": { "waiting": { "type": "object", "properties": { "reason": { "const": "budget-spent" } } } } }
    },
    {
      "description": "1.2: a record that carries a defect link is board-task@1.2.",
      "if": { "required": ["defect"], "properties": { "defect": true } },
      "then": { "properties": { "schema": { "const": "board-task@1.2" } } }
    }
  ],
  "additionalProperties": false
}
